{
  "normRef": { "doc": "ГОСТ Р 52290-2024", "clause": "п. 3.2, 3.11, разд. 4" },
  "verification": "CuratorExtracted",
  "markers": ["GOST-019"],
  "yellowBackgroundAllowed": "1.8, 1.15, 1.16, 1.18 - 1.21, 1.33, 2.6, 3.11 - 3.16, 3.18.1 - 3.25, 6.22",
  "individualDesign": "5.23.1, 5.24.1, 5.25, 5.26, 6.9.1, 6.9.2, 6.10.1 - 6.12, 6.14.1, 6.14.2, 6.17",
  "sign64OptionalSymbols": { "clause": "п. 3.11", "symbolsLike": "8.8, 8.17, 8.6.1 - 8.6.9" }
}
